{"captured_at_utc":"2026-07-23T23:31:40.971887+00:00","command":["python_baseline.py","--scenario","m4_v1_capital_fiscal","--repeat","3"],"contract_sha256":"477d1c2a59cd4b9bde5fc48070d4de3220b2c2e0378bea803e5d9c51ed33fd54","dependency_lock_sha256":"f6f11ce5d81089e463ace37671c10c08f450ca3ed85d26a9394829ed84f443ce","environment":{"architecture":"arm64","cpu_brand":"arm","logical_cpus":10,"m0_json_version":"m0-json-v1","memory_bytes":null,"os":"Darwin","os_release":"25.5.0","physical_cores":null,"power_mode":null,"processor":"arm","python_executable":"/Users/qinglinh/workspace/macro-simulator-cpp-m0/.venv/bin/python3","python_implementation":"CPython","python_version":"3.12.13"},"invariant_status":"passed","peak_rss_bytes":817577984,"process_count":3,"raw_samples_ns":{"advance":[464954716334,462501722083,465209288667],"genesis":[226693542,218194750,217345666],"load":[189252958,194378542,182738500],"save":[360700625,364119334,370438292],"snapshot":[280875,224041,284959]},"repetitions":3,"repository":{"commit":"5263805f88791dc3d08c25724ebd4d19d4b83aa7","dirty":false},"scenario_contract_sha256":"9f31a0b88a4ad1b6448db936241f9a1eae3375632f487b38e589da9e5c03a66b","scenario_id":"m4_v1_capital_fiscal","scenario_schema_version":"python-benchmark-scenarios-v1","schema_version":"python-benchmark-result-v1","semantic_result_digest":"36a2bd9db010f2b250c23e1920decbe2181aaa29676070959c4abc102900deac","statistics_ns":{"advance":{"maximum":465209288667,"median":464954716334,"median_absolute_deviation":254572333,"minimum":462501722083,"p95":465209288667,"p99":465209288667},"genesis":{"maximum":226693542,"median":218194750,"median_absolute_deviation":849084,"minimum":217345666,"p95":226693542,"p99":226693542},"load":{"maximum":194378542,"median":189252958,"median_absolute_deviation":5125584,"minimum":182738500,"p95":194378542,"p99":194378542},"save":{"maximum":370438292,"median":364119334,"median_absolute_deviation":3418709,"minimum":360700625,"p95":370438292,"p99":370438292},"snapshot":{"maximum":284959,"median":280875,"median_absolute_deviation":4084,"minimum":224041,"p95":284959,"p99":284959}},"thread_count":1,"warmup_ticks":5,"workload_counters":{"banks":1,"checkpoint_bytes":[14623038,14623038,14623038],"economies":1,"firms":750,"operations":[365,365,365],"population":5000,"snapshot_digest":"602f7d32e55169d195f19fa657813929b1c67fb43ee060e088251a1866f05fd2","ticks":365}}
